{
  "$schema": "./themes.schema.json",
  "id": "neutral",
  "name": "Neutral",
  "schemaVersion": 2,
  "light": {
    "background": "#FFFFFF",
    "foreground": "#0A0A0A",
    "card": "#FFFFFF",
    "cardForeground": "#0A0A0A",
    "popover": "#FFFFFF",
    "popoverForeground": "#0A0A0A",
    "primary": "#171717",
    "primaryForeground": "#FAFAFA",
    "secondary": "#F5F5F5",
    "secondaryForeground": "#171717",
    "muted": "#F5F5F5",
    "mutedForeground": "#737373",
    "accent": "#F5F5F5",
    "accentForeground": "#171717",
    "destructive": "#E7000B",
    "destructiveForeground": "#FCF3F3",
    "border": "#E5E5E5",
    "input": "#E5E5E5",
    "ring": "#A1A1A1",
    "chart1": "#F54900",
    "chart2": "#009689",
    "chart3": "#104E64",
    "chart4": "#FFB900",
    "chart5": "#FE9A00",
    "sidebar": "#FAFAFA",
    "sidebarForeground": "#0A0A0A",
    "sidebarPrimary": "#171717",
    "sidebarPrimaryForeground": "#FAFAFA",
    "sidebarAccent": "#F5F5F5",
    "sidebarAccentForeground": "#171717",
    "sidebarBorder": "#E5E5E5",
    "sidebarRing": "#A1A1A1"
  },
  "dark": {
    "background": "#0A0A0A",
    "foreground": "#FAFAFA",
    "card": "#171717",
    "cardForeground": "#FAFAFA",
    "popover": "#171717",
    "popoverForeground": "#FAFAFA",
    "primary": "#E5E5E5",
    "primaryForeground": "#171717",
    "secondary": "#262626",
    "secondaryForeground": "#FAFAFA",
    "muted": "#262626",
    "mutedForeground": "#A1A1A1",
    "accent": "#262626",
    "accentForeground": "#FAFAFA",
    "destructive": "#FF6467",
    "destructiveForeground": "#FFFFFF",
    "border": "#FFFFFF1A",
    "input": "#FFFFFF26",
    "ring": "#737373",
    "chart1": "#1447E6",
    "chart2": "#00BC7D",
    "chart3": "#FE9A00",
    "chart4": "#AD46FF",
    "chart5": "#FF2056",
    "sidebar": "#171717",
    "sidebarForeground": "#FAFAFA",
    "sidebarPrimary": "#1447E6",
    "sidebarPrimaryForeground": "#FAFAFA",
    "sidebarAccent": "#262626",
    "sidebarAccentForeground": "#FAFAFA",
    "sidebarBorder": "#FFFFFF1A",
    "sidebarRing": "#737373"
  },
  "fonts": {
    "sans": "Geist, sans-serif",
    "serif": "Georgia, serif",
    "mono": "Geist Mono, monospace"
  },
  "radius": 0.625,
  "spacing": 0.25,
  "tracking": {
    "normal": 0
  },
  "shadow": {
    "light": {
      "color": "#000000",
      "opacity": 0.1,
      "blur": 3,
      "spread": 0,
      "offsetX": 0,
      "offsetY": 1
    },
    "dark": {
      "color": "#000000",
      "opacity": 0.1,
      "blur": 3,
      "spread": 0,
      "offsetX": 0,
      "offsetY": 1
    }
  },
  "shadowsDerived": "from-legacy"
}
